{
  "id": "party-confirm",
  "kind": "CONFIRM",
  "title": "menu.party.confirm.leave",
  "theme": "SOCIAL",
  "size": 27,
  "params": [],
  "parent": "party",
  "dependencies": [],
  "chrome": {
    "info": "menu.party.confirm.leave",
    "back": false,
    "refresh": false,
    "close": true,
    "mainMenu": false
  },
  "slots": [
    {
      "slot": 11,
      "material": "LIME_WOOL",
      "name": "menu.confirm.yes",
      "lore": [],
      "role": "SUCCESS",
      "action": {
        "type": "MUTATION",
        "operation": "PARTY_LEAVE",
        "capability": "menu.action.party-leave"
      }
    },
    {
      "slot": 15,
      "material": "RED_WOOL",
      "name": "menu.confirm.no",
      "lore": [],
      "role": "NAVIGATION",
      "action": {
        "type": "BACK"
      }
    }
  ],
  "dynamic": null,
  "confirmation": "affects-other-players"
}
