{
  "id": "teleports",
  "kind": "LIST",
  "title": "menu.teleports.title",
  "theme": "TRAVEL",
  "size": 54,
  "params": [],
  "parent": "travel",
  "dependencies": [
    {
      "domain": "PRESENCE",
      "scope": "SERVER"
    }
  ],
  "chrome": {
    "info": "menu.teleports.title",
    "back": true,
    "refresh": true,
    "close": true,
    "mainMenu": true
  },
  "slots": [],
  "dynamic": {
    "binding": "TELEPORTS",
    "region": "INTERIOR_28",
    "emptyName": "menu.teleports.empty",
    "emptyLore": [
      "menu.teleports.empty.lore"
    ]
  },
  "confirmation": null
}
