{
  "id": "kits",
  "kind": "LIST",
  "title": "menu.kits.title",
  "theme": "ECONOMY",
  "size": 54,
  "params": [],
  "parent": "economy",
  "dependencies": [
    {
      "domain": "MENUS",
      "scope": "GLOBAL"
    }
  ],
  "chrome": {
    "info": "menu.kits.title",
    "back": true,
    "refresh": true,
    "close": true,
    "mainMenu": true
  },
  "slots": [],
  "dynamic": {
    "binding": "KITS",
    "region": "INTERIOR_28",
    "emptyName": "menu.kits.empty",
    "emptyLore": [
      "menu.kits.empty.lore"
    ]
  },
  "confirmation": null
}
