{
  "id": "claim-detail",
  "kind": "DETAIL",
  "title": "menu.claims.detail.title",
  "theme": "CLAIMS",
  "size": 54,
  "params": [
    {
      "name": "claimId",
      "required": true
    }
  ],
  "parent": "claims",
  "dependencies": [
    {
      "domain": "CLAIMS",
      "scope": "PLAYER"
    }
  ],
  "chrome": {
    "info": "menu.claims.detail.lore",
    "back": true,
    "refresh": true,
    "close": true,
    "mainMenu": true
  },
  "slots": [],
  "dynamic": {
    "binding": "CLAIM_DETAIL",
    "region": "DETAIL_BAND"
  },
  "confirmation": null
}
