{
  "id": "reports",
  "kind": "LIST",
  "title": "menu.reports.title",
  "theme": "SOCIAL",
  "size": 54,
  "params": [],
  "parent": "social",
  "dependencies": [
    {
      "domain": "PROFILES",
      "scope": "PLAYER"
    }
  ],
  "chrome": {
    "info": "menu.reports.title",
    "back": true,
    "refresh": true,
    "close": true,
    "mainMenu": true
  },
  "slots": [],
  "dynamic": {
    "binding": "REPORTS",
    "region": "INTERIOR_28",
    "emptyName": "menu.reports.empty",
    "emptyLore": [
      "menu.reports.empty.lore"
    ]
  },
  "confirmation": null
}
