{
  "id": "docs-file",
  "kind": "CUSTOM",
  "title": "menu.docs.file.title",
  "theme": "DOCS",
  "size": 54,
  "params": [
    {
      "name": "path",
      "required": true
    },
    {
      "name": "page",
      "required": true
    }
  ],
  "parent": "docs-directory",
  "dependencies": [
    {
      "domain": "LOCAL_DOCS",
      "scope": "LOCAL"
    }
  ],
  "chrome": {
    "info": "menu.docs.file.info",
    "back": true,
    "refresh": false,
    "close": true,
    "mainMenu": true
  },
  "slots": [],
  "dynamic": {
    "binding": "DOCS_FILE",
    "region": "DETAIL_BAND"
  },
  "confirmation": null
}
