{
  "id": "docs-links",
  "kind": "LIST",
  "title": "menu.docs.title",
  "theme": "DOCS",
  "size": 54,
  "params": [
    {
      "name": "path",
      "required": true
    },
    {
      "name": "page",
      "required": true
    }
  ],
  "parent": "docs-file",
  "dependencies": [
    {
      "domain": "LOCAL_DOCS",
      "scope": "LOCAL"
    }
  ],
  "chrome": {
    "info": "menu.docs.file.info",
    "back": true,
    "refresh": false,
    "close": true,
    "mainMenu": true
  },
  "slots": [],
  "dynamic": {
    "binding": "DOCS_LINKS",
    "region": "INTERIOR_28",
    "emptyName": "menu.docs.links.empty",
    "emptyLore": [
      "menu.docs.links.empty.lore"
    ]
  },
  "confirmation": null
}
