{
  "id": "admin-server-create-template",
  "kind": "CUSTOM",
  "title": "menu.admin.server.template.title",
  "theme": "STAFF",
  "size": 54,
  "params": [
    {
      "name": "kind",
      "required": true
    }
  ],
  "parent": "admin-server-create-kind",
  "dependencies": [
    {
      "domain": "ROUTING",
      "scope": "NETWORK"
    },
    {
      "domain": "PERMISSIONS",
      "scope": "PLAYER"
    }
  ],
  "chrome": {
    "info": "menu.admin.server.template.info",
    "back": true,
    "refresh": true,
    "close": true,
    "mainMenu": true
  },
  "slots": [
    {
      "slot": 22,
      "material": "OAK_SIGN",
      "name": "menu.admin.server.template.default",
      "lore": [
        "menu.admin.server.template.default.lore"
      ],
      "role": "ACTION",
      "action": {
        "type": "MUTATION",
        "operation": "SERVER_NAME_INPUT",
        "capability": "menu.action.server-name-input"
      }
    }
  ],
  "dynamic": {
    "binding": "ADMIN_SERVER_CREATE_TEMPLATE",
    "region": "DETAIL_BAND"
  },
  "confirmation": null
}
