{
  "id": "docs-directory",
  "kind": "LIST",
  "title": "menu.docs.directory.title",
  "theme": "DOCS",
  "size": 54,
  "params": [
    {
      "name": "path",
      "required": true
    }
  ],
  "parent": "root",
  "dependencies": [
    {
      "domain": "LOCAL_DOCS",
      "scope": "LOCAL"
    }
  ],
  "chrome": {
    "info": "menu.docs.directory.title",
    "back": true,
    "refresh": false,
    "close": true,
    "mainMenu": true
  },
  "slots": [],
  "dynamic": {
    "binding": "DOCS_DIRECTORY",
    "region": "INTERIOR_21",
    "emptyName": "menu.docs.directory.empty",
    "emptyLore": [
      "menu.docs.directory.empty.lore"
    ]
  },
  "confirmation": null
}
