{
  "id": "server-list",
  "kind": "LIST",
  "title": "menu.server-list.title",
  "theme": "NETWORK",
  "size": 54,
  "params": [],
  "parent": "network",
  "dependencies": [
    {
      "domain": "ROUTING",
      "scope": "NETWORK"
    }
  ],
  "chrome": {
    "info": "menu.server-list.title",
    "back": true,
    "refresh": true,
    "close": true,
    "mainMenu": true
  },
  "slots": [],
  "dynamic": {
    "binding": "SERVER_LIST",
    "region": "INTERIOR_28",
    "emptyName": "menu.server-list.empty",
    "emptyLore": [
      "menu.server-list.empty.lore"
    ]
  },
  "confirmation": null
}
